{
  "$schema": "https://json-schema.org/draft/2020-12/schema",
  "$id": "edu-schemas/plan-filminas",
  "title": "Plan de Filminas Schema v3 — Contrato Completo por Tema",
  "description": "Define la estructura completa del plan de filminas para un tema. El agente genera UN solo archivo JSON por tema. El pipeline lo lee y ejecuta sin tomar decisiones. Este schema es la fuente de verdad para validate_plan.py.",
  "version": "3.0.0",
  "date": "2026-03-25",
  "type": "object",
  "required": ["$schema_version", "meta", "slides", "summary"],
  "additionalProperties": false,
  "properties": {
    "$schema_version": {
      "type": "string",
      "const": "plan-filminas/v3",
      "description": "Versión del schema. Permite al validador saber qué reglas aplicar."
    },
    "meta": {
      "type": "object",
      "description": "Metadata del plan. Contiene toda la información de contexto para la generación.",
      "required": [
        "topic_id",
        "title",
        "source",
        "generated_at",
        "template_id",
        "topics_folder",
        "topic_folder",
        "design_system_path",
        "pipeline_runtime_path",
        "schema_registry_path"
      ],
      "additionalProperties": false,
      "properties": {
        "topic_id": {
          "type": "string",
          "pattern": "^[0-9]{2}-[a-z0-9-]+$",
          "description": "ID del tema. Formato: NN-slug (ej: 01-diseno-agil-python)."
        },
        "title": {
          "type": "string",
          "minLength": 3,
          "description": "Título legible del tema para la portada."
        },
        "source": {
          "type": "string",
          "description": "Ruta relativa a filminas.md de origen."
        },
        "generated_at": {
          "type": "string",
          "format": "date-time",
          "description": "Timestamp ISO 8601 de generación."
        },
        "template_id": {
          "type": "string",
          "minLength": 1,
          "description": "Google Slides template ID desde slides-config."
        },
        "topics_folder": {
          "type": "string",
          "description": "Ruta base de temas (ej: salida/cursadas/2026/temas)."
        },
        "topic_folder": {
          "type": "string",
          "description": "Ruta completa del tema activo."
        },
        "design_system_path": {
          "type": "string",
          "description": "Ruta al design system usado (ej: _edu/slides-config.yaml). Para trazabilidad."
        },
        "pipeline_runtime_path": {
          "type": "string",
          "description": "Ruta al pipeline runtime JSON usado (ej: _edu/slides-pipeline.json). Para trazabilidad."
        },
        "schema_registry_path": {
          "type": "string",
          "const": "_edu/schemas/schema-registry.json",
          "description": "Ruta al schema registry. Siempre fija."
        }
      }
    },
    "summary": {
      "type": "object",
      "description": "Resumen cuantitativo del plan. Calculado por el agente al generar. Verificado por el validador.",
      "required": [
        "total_slides",
        "images_planned",
        "tables_planned",
        "code_slides",
        "status",
        "pending_types",
        "pending_prompts",
        "type_distribution"
      ],
      "additionalProperties": false,
      "properties": {
        "total_slides": {
          "type": "integer",
          "minimum": 1,
          "description": "Número total de slides en el plan."
        },
        "images_planned": {
          "type": "integer",
          "minimum": 0,
          "maximum": 30,
          "description": "Número de slides con image.layer != 'none'. Máximo 30 por presentación."
        },
        "tables_planned": {
          "type": "integer",
          "minimum": 0,
          "description": "Número total de tablas a renderizar como PNG."
        },
        "code_slides": {
          "type": "integer",
          "minimum": 0,
          "description": "Número de slides que contienen code_blocks."
        },
        "status": {
          "type": "string",
          "enum": ["DRAFT", "READY_FOR_VALIDATION", "VALIDATED", "PUBLISHED"],
          "description": "Estado del plan. DRAFT=incompleto, READY_FOR_VALIDATION=agente terminó, VALIDATED=pasó validación, PUBLISHED=publicado en Slides."
        },
        "pending_types": {
          "type": "integer",
          "minimum": 0,
          "description": "Número de slides con type pendiente. Debe ser 0 para READY_FOR_VALIDATION."
        },
        "pending_prompts": {
          "type": "integer",
          "minimum": 0,
          "description": "Número de slides con image.layer!='none' pero prompt vacío. Debe ser 0 para READY_FOR_VALIDATION."
        },
        "type_distribution": {
          "type": "object",
          "description": "Conteo de slides por tipo (ej: {\"portada\": 1, \"codigo\": 12, ...}). Para auditoría.",
          "patternProperties": {
            "^(portada|concepto-abstracto|concepto-mixto|codigo|tabla|tabla-comparativa|tabla-mixta|diagrama|socratica|demo|cierre|timeline)$": {
              "type": "integer",
              "minimum": 0
            }
          },
          "additionalProperties": false
        }
      }
    },
    "slides": {
      "type": "array",
      "description": "Array ordenado de todas las slides del tema. Cada slide cumple filmina-slide.schema.json.",
      "items": {
        "$ref": "filmina-slide.schema.json"
      },
      "minItems": 1
    }
  },
  "allOf": [
    {
      "if": {
        "properties": {
          "summary": {
            "properties": {
              "status": {"enum": ["READY_FOR_VALIDATION", "VALIDATED", "PUBLISHED"]}
            }
          }
        }
      },
      "then": {
        "properties": {
          "summary": {
            "properties": {
              "pending_types": {"const": 0},
              "pending_prompts": {"const": 0}
            }
          }
        }
      },
      "$comment": "Si el plan está listo para validación, no puede tener pendientes."
    }
  ]
}
