{
  "$schema_version": "plan-filminas/v3",
  "meta": {
    "topic_id": "13-subprogramas-parametros-sobrecarga",
    "title": "CLASE 13A",
    "source": "filminas.md",
    "generated_at": "2026-06-11T13:04:07",
    "template_id": "1mGncfOizGbRHXNo5xqi9wfqePnlnGKbZUtlvTysYMsI",
    "topics_folder": "C:\\Users\\matia\\paradigmas2026\\salida\\cursadas\\2026\\temas",
    "topic_folder": "C:\\Users\\matia\\paradigmas2026\\salida\\cursadas\\2026\\temas\\13-subprogramas-parametros-sobrecarga",
    "design_system_path": "_edu/slides-config.yaml",
    "pipeline_runtime_path": "_edu/slides-pipeline.json",
    "schema_registry_path": "_edu/schemas/schema-registry.json"
  },
  "summary": {
    "total_slides": 31,
    "images_planned": 12,
    "tables_planned": 8,
    "code_slides": 12,
    "status": "READY_FOR_VALIDATION",
    "pending_types": 0,
    "pending_prompts": 0,
    "type_distribution": {
      "portada": 1,
      "concepto-mixto": 11,
      "tabla-comparativa": 5,
      "socratica": 5,
      "concepto-abstracto": 5,
      "tabla": 3,
      "cierre": 1
    }
  },
  "slides": [
    {
      "id": "F-00",
      "type": "portada",
      "title": "Portada 13A",
      "subtitle": "CLASE 13A",
      "body_blocks": [
        {
          "type": "heading",
          "level": 2,
          "content": "Subprogramas: del contrato a la ejecución"
        },
        {
          "type": "list",
          "ordered": false,
          "items": [
            {
              "content": "¿Qué promete un subprograma?",
              "level": 0
            },
            {
              "content": "¿Cómo se comunican llamador y llamado?",
              "level": 0
            },
            {
              "content": "¿Qué decisiones favorecen seguridad, reutilización y recursividad?",
              "level": 0
            },
            {
              "content": "¿Cómo implementa el runtime una llamada?",
              "level": 0
            }
          ]
        }
      ],
      "code_blocks": [],
      "tables": [],
      "layout": {
        "title": "full-title",
        "body": "center-bottom",
        "image": "background",
        "code": "none",
        "table": "none"
      },
      "image": {
        "layer": "background",
        "prompt": "Balanced composition of bordo circles and dark gray rectangles connected by thin lines on white background, with clear empty space. Flat design. Sin texto, sin letras, sin etiquetas, sin codigo, sin numeros. Alta resolucion.",
        "local_asset": "slides/assets/F-00-bg.png",
        "drive_id": null
      },
      "table_assets": []
    },
    {
      "id": "F-01",
      "type": "concepto-mixto",
      "title": "Un subprograma abstrae una acción",
      "subtitle": "Un subprograma permite razonar por contrato, no por instrucciones",
      "body_blocks": [
        {
          "type": "list",
          "ordered": false,
          "items": [
            {
              "content": "Tiene un punto de entrada y devuelve el control al llamador.",
              "level": 0
            },
            {
              "content": "Su encabezado establece qué datos recibe y qué resultado produce.",
              "level": 0
            },
            {
              "content": "El cuerpo queda oculto durante el uso: el cliente invoca una abstracción.",
              "level": 0
            },
            {
              "content": "Cada llamada crea una activación distinta del mismo código.",
              "level": 0
            }
          ]
        },
        {
          "type": "text",
          "content": "`[Sebesta, §9.1, pp. 389-394]`"
        }
      ],
      "code_blocks": [
        {
          "lang": "typescript",
          "content": "function distancia(x1: number, y1: number,\n                   x2: number, y2: number): number {\n  return Math.hypot(x2 - x1, y2 - y1);\n}"
        }
      ],
      "tables": [],
      "layout": {
        "title": "full-title",
        "body": "left-middle",
        "image": "none",
        "code": "right-half",
        "table": "none"
      },
      "image": {
        "layer": "none",
        "prompt": "",
        "local_asset": "",
        "drive_id": null
      },
      "table_assets": []
    },
    {
      "id": "F-02",
      "type": "tabla-comparativa",
      "title": "La definición y la llamada cumplen roles distintos",
      "subtitle": "Definición y llamada forman un contrato",
      "body_blocks": [
        {
          "type": "text",
          "content": "`[Sebesta, §9.1]`"
        }
      ],
      "code_blocks": [],
      "tables": [
        "| Elemento | En la definición | En la llamada |\n|---|---|---|\n| Nombre | Identifica el servicio | Selecciona el servicio |\n| Parámetros | Formales: variables locales del llamado | Reales: valores o expresiones aportadas |\n| Perfil | Número, orden y tipos de parámetros | Debe ser compatible con los argumentos |\n| Protocolo | Perfil más tipo de retorno | Determina el tipo de la expresión resultante |\n| Cuerpo | Implementa el servicio | Permanece oculto al cliente |"
      ],
      "layout": {
        "title": "full-title",
        "body": "table-intro",
        "image": "none",
        "code": "none",
        "table": "table-main"
      },
      "image": {
        "layer": "none",
        "prompt": "",
        "local_asset": "",
        "drive_id": null
      },
      "table_assets": [
        {
          "index": 0,
          "table_markdown": "| Elemento | En la definición | En la llamada |\n|---|---|---|\n| Nombre | Identifica el servicio | Selecciona el servicio |\n| Parámetros | Formales: variables locales del llamado | Reales: valores o expresiones aportadas |\n| Perfil | Número, orden y tipos de parámetros | Debe ser compatible con los argumentos |\n| Protocolo | Perfil más tipo de retorno | Determina el tipo de la expresión resultante |\n| Cuerpo | Implementa el servicio | Permanece oculto al cliente |",
          "local_asset": "slides/assets/F-02-table-1.png",
          "drive_id": null
        }
      ]
    },
    {
      "id": "F-03",
      "type": "tabla-comparativa",
      "title": "Procedimiento y función expresan intenciones diferentes",
      "subtitle": "El retorno distingue cálculo de efecto",
      "body_blocks": [
        {
          "type": "text",
          "content": "`[Sebesta, §9.1 · Gabbrielli/Martini, cap. 5]`"
        }
      ],
      "code_blocks": [],
      "tables": [
        "| Decisión | Procedimiento | Función |\n|---|---|---|\n| Intención principal | Cambiar el estado o producir un efecto | Calcular un valor |\n| Resultado | Implícito en el estado modificado | Explícito mediante retorno |\n| Composición | Se encadena por secuencia | Se compone dentro de expresiones |\n| En TypeScript | Retorno `void` | Retorno tipado |\n| Riesgo | Efectos difíciles de rastrear | Dependencia de entradas y entorno |"
      ],
      "layout": {
        "title": "full-title",
        "body": "table-intro",
        "image": "none",
        "code": "none",
        "table": "table-main"
      },
      "image": {
        "layer": "none",
        "prompt": "",
        "local_asset": "",
        "drive_id": null
      },
      "table_assets": [
        {
          "index": 0,
          "table_markdown": "| Decisión | Procedimiento | Función |\n|---|---|---|\n| Intención principal | Cambiar el estado o producir un efecto | Calcular un valor |\n| Resultado | Implícito en el estado modificado | Explícito mediante retorno |\n| Composición | Se encadena por secuencia | Se compone dentro de expresiones |\n| En TypeScript | Retorno `void` | Retorno tipado |\n| Riesgo | Efectos difíciles de rastrear | Dependencia de entradas y entorno |",
          "local_asset": "slides/assets/F-03-table-1.png",
          "drive_id": null
        }
      ]
    },
    {
      "id": "F-04",
      "type": "concepto-mixto",
      "title": "Perfil y protocolo permiten verificar llamadas",
      "subtitle": "El protocolo convierte una función en un valor tipado",
      "body_blocks": [
        {
          "type": "list",
          "ordered": false,
          "items": [
            {
              "content": "El **perfil** incluye cantidad, orden y tipos de los parámetros.",
              "level": 0
            },
            {
              "content": "El **protocolo** agrega el tipo de retorno.",
              "level": 0
            },
            {
              "content": "El chequeo estático rechaza llamadas incompatibles antes de ejecutar.",
              "level": 0
            },
            {
              "content": "El mismo concepto reaparece en sobrecarga y funciones de orden superior.",
              "level": 0
            }
          ]
        },
        {
          "type": "text",
          "content": "`[Sebesta, §9.1, pp. 392-394]`"
        }
      ],
      "code_blocks": [
        {
          "lang": "typescript",
          "content": "type Distancia = (\n  x1: number, y1: number,\n  x2: number, y2: number\n) => number;"
        }
      ],
      "tables": [],
      "layout": {
        "title": "full-title",
        "body": "left-middle",
        "image": "none",
        "code": "right-half",
        "table": "none"
      },
      "image": {
        "layer": "none",
        "prompt": "",
        "local_asset": "",
        "drive_id": null
      },
      "table_assets": []
    },
    {
      "id": "F-05",
      "type": "socratica",
      "title": "Actividad: reconstruir el contrato",
      "subtitle": "¿Qué puede saber el cliente sin leer el cuerpo?",
      "body_blocks": [
        {
          "type": "heading",
          "level": 2,
          "content": "Actividad de 5 minutos"
        },
        {
          "type": "list",
          "ordered": false,
          "items": [
            {
              "content": "Escriban el perfil y el protocolo de `distancia`.",
              "level": 0
            },
            {
              "content": "Propongan una llamada válida y dos llamadas inválidas.",